{
  "schema_version": 1,
  "status": "passed",
  "command": "./integration/p12/qualify.sh",
  "started_at": "2026-10-21T17:06:46.262372Z",
  "finished_at": "2026-10-21T17:08:20.648382Z",
  "source": {
    "identity": "content-addressed-artifacts",
    "artifacts": {
      ".github/workflows/p00.yml": "9d563c8320d4229a354a7db42fbc30392f27a224eb15b1030de217cada890e2d",
      ".gitignore": "bae032507e83a8ab43fe6ce6697c1e08c0d0ecf7396d7614acd8c994dd6c785c",
      "LICENSE": "10d2b9ae287146e3523195935cd9e2b79658acb32a73e974d8072cfbd1e34f43",
      "Makefile": "f1a94919ed26f2d2b88609117af86259c1ef7cfcb2e4b90550c170cfd51a3da2",
      "README.md": "37a08d1e78bb050156e82b272f4b6e7cc4e826dd5f312ad321bdcdc7556a57bb",
      "SECURITY.md": "38c8479cd9dc70540c09e38957302a3e0c892d45b8622e4a933eb30a780813d9",
      "SPEC.md": "933fb55517ee2aaaa9d7eefb775c561f01638b033fa1f541a2f69b67972cdd67",
      "THIRD_PARTY_NOTICES": "7c36fce9f9ff6adfbf728b640ebff7c57dffe69c62ef07584cec894c7d35ecb1",
      "admin.go": "633e981154cf48ebfb297cc5e617227f50e52a0457786cdabaaa333888211ae5",
      "admin_test.go": "ccd2dd8e24ecd05e571acf6aeec4e83e06284a38d772b3975443326103cc578f",
      "changes.go": "34106d934b1da23a751d78ef04899fb5edcf80aa73d8c235f0b57e95adc177e9",
      "changes_test.go": "ac746f3f841f6d6b2fd1d9a1d492022f65ac18eb33148b46b9a86973e895ffb9",
      "client.go": "84babbf3657b368580f1d4ef76f4722ffbab5917f106f244f586427cf6b52f08",
      "client_test.go": "4e26e6dd16fa4eb3f8550a73ab67a9dcb354807691ba50da9e4534088b454f03",
      "config.go": "63287e850b19c9a89cb89aa93306fcd1366d1615004a975ad6eb58d99bb2153c",
      "config_fuzz_test.go": "33de5ab9fc68a9fdfeb1116c5a844ff9b96cf4ac7bbe5d08cad4907e66e0c7c3",
      "config_test.go": "b47ce1b64bb09a6b64b4621b517f0c452e71a4db32256bd0af878598e1113d49",
      "coordination.go": "eaede536b5373251f9b0c1f99f5cde2295afcf8e57c21491a7fbb77d80815430",
      "coordination_test.go": "52718d25d9b231fe872a357c9872a1448333357c3f78709c964a00a910fdf834",
      "doc.go": "029e90e8a1a61bb7e92db5d30d97c26c6adb73e4afc11ea22e1f7d82c30f3f6e",
      "docs/PERFORMANCE_SCALABILITY_REVIEW.md": "146c029a05711d7ce21b66f702ceadb210a2ef783cff3620ad90b6631a07151b",
      "docs/RUST_PORT_SPEC.md": "cb3500d5d06a298cfe7d31a512e8d3cb91c5c18a33d9df1fd85901900a7c6c6d",
      "docs/p00/README.md": "1728266690d7ac1cbdd72870591d6587b4ede94cdbb8b3493e6c675fe3983fee",
      "docs/p00/api-inventory.csv": "fc73c6b8f7cc63699a0e9e135342cf474c679d7577677ad858cb5a72118f623a",
      "docs/p00/compatibility.md": "e0cb5d107e576d5f775ecbf2c71b24f31a754cc1294e9b7611d79182ad1da61c",
      "docs/p00/evidence.json": "efcc2fdabc4ed21cb1e59be8c45d4bb85c4b3b36e34b56f8bf0ff30ba12bd6a6",
      "docs/p00/licensing.md": "f67d0067c7ee339d2901a4bc1f15e45571c396b25d9d5352636611b838719cb7",
      "docs/p00/protocol-sources.md": "2826b7096405cfaea4eee8d3bad288609c1569890948f2c641d2c25fcc5dc4bd",
      "docs/p00/task-handoff.md": "f4a885f5be4e1cee03b3f13115466a32ad6d7802bfdc3cbafc2656d908b3f570",
      "docs/p00/tasks.md": "c3dc1cd508c78bd2abef52e4ced7b319071e1b4b6e8df97fe6f3f887ed6db401",
      "docs/p00/threat-model.md": "aefd2db97776f846109303d0c89b9ccd418efb8170574e69f5f915c4e37bbd65",
      "docs/p01/README.md": "dafc588922ec8607126488995f8762c84fa7632c6195a70779c4aa347e38607b",
      "docs/p01/api-contract.md": "58f29141009e0f322b1c94aa6b6cc6486c6d7904656a5248248bb5ecc0402676",
      "docs/p01/evidence.json": "0ba1ce1ec9f4a1a8cfceb66a10e5582284de265e46a9ace9dd78856f95415f52",
      "docs/p01/provenance.md": "c2efa9b2472b4b34ef451b5e9d7fa0ac6ef53bbee83303b5c136f6b6f0ad37bc",
      "docs/p01/public-api.md": "99fb6a557d608c805a4d656242ea3052d21348351ea1d5695ae59df7d339e24a",
      "docs/p01/task-handoff.md": "a1d1a97589df6401c77e2df884972806970e8eae04c55ed63b1434ad95e6fa60",
      "docs/p01/tasks.md": "b557f786d2d5fd8e00568e75c8b92e47d968df349e92baa89e42d45e01845cc1",
      "docs/p02/README.md": "339e02b7a0f0dd4008a1cd853e7d3ad0b1573b79a58dcfa8b7c53e121ff6a251",
      "docs/p02/architecture.md": "f35e001cf62b584ed57a1473b64a3d03062a79da328763fd66e24190429fa420",
      "docs/p02/evidence.json": "9bed9432b6efe409a9a66189e22e76b1a24fbfd35a4353137c5831c27c6b4588",
      "docs/p02/provenance.md": "6c1799f966fe7a1945891a0f964b43953847a4fce5bd11f22fd3461d06602f0a",
      "docs/p02/security.md": "8eaa7bb4b7887e99376c3965675272df38d5f2cf4b4d859ad9fb7d88d025778e",
      "docs/p02/task-handoff.md": "60ce2a28ada0e39cea8d0310198bd9d18ef6122610fff3b99efd015a85ef5f70",
      "docs/p02/tasks.md": "a438972f75f8e9c7e6ab83fb386d1fccb3370f9c5d5a7f6afce81b631aa5ad3e",
      "docs/p03/README.md": "05fae4acbd8c607aca9b0f424db62a3f9850c7bf9abf0dfa08eca22f81430a83",
      "docs/p03/evidence.json": "f46f33a0dfff1afa1bf9bd5132fc873ad4ba91129192c3653eec82736f73cae8",
      "docs/p03/integration-report.json": "5e9c1c9c3fb153a1a4113e2df873820a6ca9ac027fad191e9ed1d053f294bb47",
      "docs/p03/modules.txt": "58474bab6a17048075e8cdfc07b2006906620eba332acc4fcf72eb60c04183ae",
      "docs/p03/provenance.md": "b2dc1c6c5f2345bdb5e185ecf4a32557f0494b9bb30dbb55c72cc961a4ffb493",
      "docs/p03/security.md": "218b9eabeab18f130c0e4a4f746b5eadcdafee2d9da705f241537b63f24276cf",
      "docs/p03/tasks.md": "56d276199d42982ccf90dfcd25367c935810bca998f77b67ccb36e2ba48d3147",
      "docs/p04/configuration.md": "fa2ac1e0cc7cab501077f2a293964d3cdcaf72732d9a9716b7db7ed2e498e291",
      "docs/p04/integration-report.json": "ae46403de6ecfa2b7dd69caf92410c2a278d22a2b2da56a83ebb4d6f7fea5421",
      "docs/p04/provenance.md": "51389d19c4d5a60c5cdf69d2c1c3c94cd68ab0181acc044b4a27678af67482bf",
      "docs/p04/tasks.md": "699db74543e65bbfe0c983f7318e013698b1cc5477bd9efe5f088ac4e33dc737",
      "docs/p05/provenance.md": "16e6e866c7c99f3cb1af712d583029a46889ed909c5ab0e4c6bf9ca3de0b40f8",
      "docs/p05/tasks.md": "5017ef5440f12bea59306f54012e6f92cc4f838d576d5115991f2b4630bbbc5b",
      "docs/p06/integration-report.json": "88a1a984c955933b240340d3bfd36582e34a9d2e58a63e3a86e1d184522e8f6e",
      "docs/p06/provenance.md": "f2552c6f4d0be72d289bed41acebb5111bd9d0ba1c92ee65c5f775500cc18307",
      "docs/p06/tasks.md": "a121e52e6b6b7692a4e019fb86a47a4dfd1b8ca4cde000c1761c027476f8c23e",
      "docs/p07/integration-report.json": "2e531407ad54dffcf8eed991599a00d75a62aad0b7008fec67e4a7623dc0243a",
      "docs/p07/provenance.md": "446d842547cb93438ff50d3bcd90c30a200478b779f122f802979472cee7c164",
      "docs/p07/tasks.md": "0ed1f9917cefe0799387fe983fae75b1032d26bdaad77b8ccf2bec84f5b8676d",
      "docs/p08/integration-report.json": "81dafd374734be9db81aa339d7a7350d8b99dbdd1198a53f70c2dc7e5c3887e8",
      "docs/p08/provenance.md": "9183ff0e77c3c5b00702f060b40f88a589eda14e4a623db89057a0061c9ea35b",
      "docs/p08/tasks.md": "b7ffb6a83d62cfbc973812d8a5dd1d91b95ec1295895edd10c7d4c1f9a070c46",
      "docs/p09/integration-report.json": "8a69bc020ef69122a6391f53c52c7af7239d47091e56b2ff3406631e86fd1a5e",
      "docs/p09/provenance.md": "d928e23024df6ef36a7bbad594fad7133a83e4d828da707d99aeea5bc2083ab9",
      "docs/p09/tasks.md": "d0c2e0ec62cb0c6f2deff0dd5f6fc415e61eb407bba7f2736f404f3bd20b9489",
      "docs/p10/integration-report.json": "b15a6d9eae790b406d63f773b3842bd0cef613c192bcfc2148018c0c471bbd43",
      "docs/p10/provenance.md": "104d2fae853014f049371c6d5851eba382e4a59d2423256b0549a7e4f43e69f5",
      "docs/p10/tasks.md": "f15b6c170e53ea8c4346e729eacd52b472aa939ba102114b00a68f63d02ecb0d",
      "docs/p11/integration-report.json": "bad9006cd13baca8f6dba0cc99ff755054ac04c44ea6763e196346bddbe08e99",
      "docs/p11/provenance.md": "3bde3fcd952d714e5450ef7642082ecd3c739780fb0449b5cf750911b8981c0d",
      "docs/p11/tasks.md": "dfa0aade3a54b4e8bdf6aab78ba6473bebdda0009a2973e0e510db2eb3db4ea0",
      "docs/p12/README.md": "ce02adc81303a720bbdcb2453338421c746c811403e279a8e786f7e6cc595a5e",
      "docs/p12/api-coverage.md": "b50450fc2eeeb6da4a023607b2ea09bc70129d10cf28f906068049015b4c2c6f",
      "docs/p12/automated-review.md": "9dd71612c07f768dbe94123bb440a8afc18b21cd863c0a88cad618b3a5e1d483",
      "docs/p12/cgo-migration.md": "4910cc32b4fe8ad957ba97f889ffcac83a3aaf0437e9ceb8ebe327ff972566a8",
      "docs/p12/compatibility.md": "ce9d22a7226a4a350b5fb521ce9034fb94246178f520ec10df92a6b5a1f2bf95",
      "docs/p12/dependencies.md": "2422d446964119fc30abe3cf09ad4764055ac2dd5fdafb1ad99def83eb817762",
      "docs/p12/human-review.md": "1ad11e952be490cf51ba56dd23a32cd3d0c19463368c7e6dffad7418f0bd9837",
      "docs/p12/performance.md": "e78c2c595ff790c95f92f0f77caadbb16ff379e508cf46ee64d11862482d1edf",
      "docs/p12/release.md": "4895fccd3c958a25dfc1f07e0e6190ae7c0ddda0f99e8b05d24c6f7e5082c62b",
      "docs/p12/review-template.md": "7f89486c65bc75b7b17e39b83d75e4a535fccda89efd33256af3b55d7b3224ca",
      "docs/p12/reviewer-trust.json": "9e2d9eaa0a8b30ebdc6226ae3c959bb2e89c7e2f48559b3af744b954dd6365e1",
      "docs/p12/troubleshooting.md": "e40957defc66437ebbeca650092307bcc1daf3b3cc1f439ea650aa2c60e59c73",
      "docs/p13/README.md": "a340926b4d887ab711460470c9bc38b3488af290d79ecb49c2869f045d143833",
      "docs/p13/compatibility.md": "eb74c3391cce11cb3304f9be00ac76b5206fa9de5f9668d0efda701a7555e158",
      "docs/p13/provenance.md": "1bf5ff41c9b7c4d6b96d6116cd88ab7cdc2edbdcd3c2f051238ce951b3f57e75",
      "docs/p13/task-handoff.md": "f1874bb338077347a971ccb57565e6f99e2776fa463ab476413162c5b02421e4",
      "docs/p13/tasks.md": "a8f7ab70d8b887ffc4d1555deed4c91b2382b569cb4f1e1eb2b518f27272cc6d",
      "docs/performance-p99-scheduler/BATCHING_RESULTS.md": "3e9cf4b1706386fa5b318b14afa3b20b014ecb6d875a148eac1782913de5c9a5",
      "docs/performance-p99-scheduler/CALLER_BUFFER_DESIGN.md": "c05569a5bebb8741b614a3c871462c08a9080386ff2144c6ac00e197e5b95fde",
      "docs/performance-p99-scheduler/EXPERIMENT_CACHE.md": "1a24b01bfd3c8307032995884199b2f61512267a4596e4e311513ff748a0b345",
      "docs/performance-p99-scheduler/EXPERIMENT_VERDICTS.md": "7d2a065bf3c32ff199dbc193a6da3754775bac015f7ef827ca7339514d919e7c",